Beteiligte;Objektbezeichnung;InvNr;Foto neu vorhanden?;Bild Nr neu;Bild bearbeitet?;Jahr_von;Jahr_bis;Datierung;Geogr_Bezug;Gattung;Maße;Material;Beschriftung;Verw_Institution;Sammlungsbereich;Akt_Standort;;Titel_Sammlung;Beschreibung_Notizen;unsere Notizen;OSM (Koordinaten);URL 1;URL 2;Foto von ;;;
Carl Friedrich Mylius, (?), Objekt ist Geschenk von C. F. Mylius (Inventarbuch C 03, S. 1);Stadtansicht;C02296;;;;1845;1865;um 1855;Frankfurt am Main;Druckgrafik oder Handzeichnung;"Blattmaß: 17,9 x 30,5 cm; Objektmaß: 36,4 x 53 cm Passepartout-Karton";"Passepartout-Karton; Papier; Lithographie (Lithographie mit Tonplatte lt. Inventarbuch C 03, S. 1), Ton-Lithographie (Karteikarte); Bleistiftzeichnung (Katalog Frankfurts demokratische Moderne und Leopold Sonnemann, 2009, Kat. B 102)";;Historisches Museum Frankfurt, Frankfurt am Main;Grafische Sammlung;Graphische Sammlung;;Frankfurt am Main vom Mühlberg gesehen mit der Frankfurt-Offenbacher Eisenbahn;;;;;;;;;
Carl Friedrich Mylius;Dokumentarfotografie, Stadttopographie;C02737;ja;;;1851;1860;September 1860;Frankfurt am Main-Eckenheim, Hauptfriedhof (Grab Arthur Schopenhauer);Dokumentarfotografie;"Bildmaß: 23,4 x 18,8 cm; Objektmaß: 52,8 x 36 cm";"Papier; Albuminabzug";"auf Kaschierkarton unter dem Foto: ""Grab von Arthur Schopenhauer auf dem Frankfurter Kirchhof, photog. gleich nach dem Begräbniss. Er starb 21 Sept. 1860"" (Bleistift)";Historisches Museum Frankfurt, Frankfurt am Main;Fotografie;;;Grab von Arthur Schopenhauer auf dem Frankfurter Kirchhof (Hauptfriedhof), fotografiert gleich nach dem Begräbnis. Schopenhauer starb am 21. September 1860;"Mylius hat dieses Grab auf dem Hauptfriedhof unmittelbar nach dem Begräbnis im September 1860 photographiert. Anlass dürfte neben der Popularität des Philosophen auch die persönliche Begegnung mit ihm gewesen sein. Mylius hatte Schopenhauer zwei Jahre zuvor portraitiert und bei dieser Gelegenheit dessen schwierigen Charakter kennengelernt. 
(Eberhard Mayer-Wegelin, Das alte Frankfurt am Main 1855 - 1890, 2014, S. 189)";;50.13324, 8.68478;;;;;;
Carl Friedrich Mylius;Architektur, Stadttopographie;C02740;nein;;;1861;1870;1869;Frankfurt am Main-Innenstadt, Klapperfeld (Landwirtschaftliche Halle);Architekturfotografie;"Bildmaß: 21,3 x 30,6 cm; Objektmaß: 36 x 53 cm";"Papier; Albuminabzug";Landwirtschaftliche Halle im Klapperfeld;Historisches Museum Frankfurt, Frankfurt am Main;Fotografie;;;Die Landwirtschaftliche Halle im Klapperfeld, erbaut 1869, abgerissen 1881;"In der östlichen Innenstadt im Jahr 1869 gebaut, wurde die Halle 1881 im Zusammenhang mit der Verlängerung der Zeil abgerissen und am Ostendplatz neu errichtet. Sie diente als Unterkunft für bis zu 550 Pferde und hatte damit Bedeutung für den traditionellen Frankfurter Pferdemarkt, den der 1860 gegründete Landwirtschaftliche Verein wiederbelebt hatte.
(Eberhard Mayer-Wegelin, Das alte Frankfurt am Main 1855 - 1890, 2014, S. 183, zu der Variante in Privatbesitz)";1881 im Zusammenhang mit der Verlängerung der Zeil abgerissen und am Ostendplatz neu errichtet;;;;;;;
"Carl Friedrich Mylius; Kein Eintrag, alte Zuschreibung";Architektur, Stadttopographie;C02747;nein;;;1881;1890;April 1881;Frankfurt am Main-Westend;Fotografie;"Bildmaß: 22,5 x 29,7 cm; Objektmaß: 36,2 x 52,7 cm";"Papier; Albuminabzug";"laut Beschriftung unten, auf Kaschierkarton, ist die Fotografie in nur zwei Exemplaren vorhanden: ""Das Hauptgebäude der Patent= u. Musterschutz=Ausstellung (entworfen von Archt. Linnemann) im Bau begriffen. Aufgenommen im Apl. 1881 von C. F. Mylius (existiert nur in 2 Exemplaren)"" (Bleistift)";Historisches Museum Frankfurt, Frankfurt am Main;Fotografie;;;Das Hauptgebäude der Allgemeinen Deutschen Patent- und Musterschutz-Ausstellung zu Frankfurt 1881, im Bau begriffen;"Das hölzerne Ausstellungsgebäude wurde eigens für die Ausstellung errichtet, auf der Handelsprodukte gezeigt wurden, die zum Patent- oder Musterschutz angemeldet waren.
(Eberhard Mayer-Wegelin, Das alte Frankfurt am Main 1855 - 1890, 2014, S. 276)";existiert heute nicht mehr;;;;;;;
"Carl Friedrich Mylius; Kein Eintrag, alte Zuschreibung";Architektur, Stadttopographie;C02748;nein;;;1881;1890;April 1881;Frankfurt am Main-Westend;Fotografie;"Bildmaß: 30,6 x 24,8 cm; Objektmaß: 52,8 x 36,3 cm";"Papier; Albuminabzug";"laut Beschriftung unten, auf Kaschierkarton, ist die Fotografie in nur zwei Exemplaren vorhanden: ""Das Innere des Hauptbaues d. Patent= u. Musterschutz=Ausstellung, im Bau begriffen Apl. 1881 (nur in 2 Exempl. vorhanden)"" (Bleistift)";Historisches Museum Frankfurt, Frankfurt am Main;Fotografie;;;Das Innere des Hauptbaues der Allgemeinen Deutschen Patent- und Musterschutz-Ausstellung zu Frankfurt 1881, im Bau begriffen;"Der Entwurf für die Halle stammt von dem Frankfurter Architekten und Glasmaler Alexander Linnemann, der bereits an der Innengestaltung beim Wiederaufbau des Doms beteiligt war
(Eberhard Mayer-Wegelin, Das alte Frankfurt am Main 1855 - 1890, 2014, S. 277). Ganz unten links ist ein kleines Schild mit ""Zoologischer Garten"" (Rest nicht entzifferbar).";s.oben;;;;;;;
Carl Friedrich Mylius;Architektur, Stadttopographie;C02749;ja;;;1861;1870;1870;Frankfurt am Main-Altstadt, Judengasse;Architekturfotografie;"Bildmaß: 21,1 x 28,2 cm; Objektmaß: 36,5 x 53 cm Passepartout-Karton";"auf Karton aufgezogen; Papier; Albuminabzug";;Historisches Museum Frankfurt, Frankfurt am Main;Fotografie;;;Die Judengasse nach der Niederlegung der westlichen Häuserreihe;"Die Gebäude der westlichen Seite wurden 1874 vollständig abgerissen, die östliche Seite bis auf einige Ausnahmen1885. Die Hauptsynagoge links war 1860 am alten Ort neu errichtet und von Mylius für die Leipziger Illustrierte Zeitung photographiert worden. (Eberhard Mayer-Wegelin, Das alte Frankfurt am Main 1855 - 1890, 2014, S. 54)

";"links Hauptsynagoge; zerstört 1938, gegenüber der Einmündung Allerheiligenstraße in Kurt Schumacher; An Haus 41 befindet sich eine Gedenktafel ";50.11362, 8.68756;https://de.wikipedia.org/wiki/Frankfurter_Judengasse#/media/File:Frankfurt-Ravenstein1861-Bl5%2B6-Crop-Judengasse.jpg;;;;;
Carl Friedrich Mylius;Architektur, Dokumentarfotografie;C02755;;;;1871;1880;August 1876;Frankfurt am Main-Innenstadt, Bleichgartenplatz, Landwirtschaftliche Halle;Fotografie;"Bildmaß: 27,5 x 20,3 cm; Objektmaß: 52,7 x 36,4 cm";"Papier; Albuminabzug";;Historisches Museum Frankfurt, Frankfurt am Main;Fotografie;;;Bierbrauer-Ausstellung in Frankfurt, Eingang zur Bierbrauer-Ausstellung auf dem Bleichgartenplatz und in der Landwirtschaftlichen Halle;"Die Ausstellung fand im August 1876 in der Landwirtschaftlichen Halle und auf einem davorliegenden Außengelände statt. Der Torbogen ist ein typisches Beispiel für derartige Schauarchitekturen, die nach der Veranstaltung wieder abgetragen wurden.
(Eberhard Mayer-Wegelin, Das alte Frankfurt am Main 1855 - 1890, 2014, S. 270)";es gibt eine Straße im Bleichgarten?;;;;;;;
Carl Friedrich Mylius;Architektur, Dokumentarfotografie;C02756;;;;1871;1880;August 1876;Frankfurt am Main-Innenstadt, Bleichgartenplatz, Landwirtschaftliche Halle;Architekturfotografie;"Bildmaß: 22 x 29,1 cm; Objektmaß: 36,3 x 52,6 cm";"Papier; Albuminabzug";;Historisches Museum Frankfurt, Frankfurt am Main;Fotografie;;;Bierbrauer-Ausstellung in Frankfurt, Inneres der Landwirtschaftlichen Halle;"Zu sehen sind zahlreiche Stände einheimischer und auswärtiger Firmen.
(Eberhard Mayer-Wegelin, Das alte Frankfurt am Main 1855 - 1890, 2014, S. 272)";;;;;;;;
Carl Friedrich Mylius;Architektur, Stadttopographie;C02763;ja;;;1871;1880;1879;Frankfurt am Main-Innenstadt, Schillerplatz, Biebergasse;Architekturfotografie;"Bildmaß: 21,4 x 28,5 cm; Objektmaß: 36,4 x 53 cm";"Papier; auf Karton aufgezogen; Albuminabzug";;Historisches Museum Frankfurt, Frankfurt am Main;Fotografie;;;Schillerplatz, Häuserreihe nach Westen mit der Biebergasse;"Der Schillerplatz schließt sich nördlich an die Hauptwache an, wurde ursprünglich für Paraden des städtischen Militärs genutzt und hieß deshalb Paradeplatz. Nach der Aufstellung des Schillerdenkmals im Jahr 1864 wurde er in Schillerplatz umbenannt.
(Eberhard Mayer-Wegelin, Das alte Frankfurt am Main 1855 - 1890, 2014, S. 60, zu dem identischen Motiv C27048)";https://de.wikipedia.org/wiki/An_der_Hauptwache#/media/File:Frankfurt-Ravenstein1861-Bl5-Hauptwache.jpg          Eckhaus Biebergasse;50.11383, 8.6782,;;;;;;
"Carl Friedrich Mylius; Jakob Heinrich Christoph Gustav Kaupert, des Börne-Denkmals";Dokumentarfotografie, Stadttopographie;C03088;ja;;;1871;1880;06.06.1877;Frankfurt am Main-Innenstadt, Bockenheimer Anlage (Börne-Denkmal);Dokumentarfotografie;"Bildmaß: 27,5 x 21,3 cm; Objektmaß: 53 x 36,3 cm Passepartout-Karton";"Papier; Passepartout-Karton; Albuminabzug";"recto, auf Kaschierkarton: ""Das Börne-Denkmal in der Bockenheimer Anlage. Von Kaupert  Am Tage der Enthüllung, 6. Juni 1877, 11 Uhr. Photo. v. C. F. Mylius"" (schwarze Tinte)";Historisches Museum Frankfurt, Frankfurt am Main;Fotografie;Graphische Sammlung;;Das Börne-Denkmal in der Bockenheimer Anlage (von Prof. Jakob Kaupert) am Tage der Enthüllung, 6. Juni 1877, 11 Uhr;"Mylius fotografierte das Denkmal am 6. Juni 1877, dem Tag der Enthüllung zum 40. Todestag von Börne. Es wurde in der Bockenheimer Anlage errichtet zum Gedenken an den in Frankfurt geborenen Journalisten, Literatur- und Theaterkritiker, der zum Wegbereiter der literarischen Kritik in Deutschland wurde un 1830 ins Pariser Exil ging.
(Eberhard Mayer-Wegelin, Das alte Frankfurt am Main 1855 - 1890, 2014, S. 273)";"1931 Büste zerstört; Gedenkplatte von Georg Mahr  steht seit 1960  am ursprünglichen Standort ";50.11722,8.67720,könnte es hier gewesen sein? ;http://www.ffmhist.de/ffm33-45/portal01/portal01.php?ziel=t_hm_boernedenkmal;https://www.kunst-im-oeffentlichen-raum-frankfurt.de/de/page128.html?id=22;;;;
Carl Friedrich Mylius;Architektur, Stadttopographie;C03089;;;;1871;1880;1872;Frankfurt am Main-Gutleutviertel, Gutleuthöfe;Architekturfotografie;"Bildmaß: 21,6 x 32,1 cm; Objektmaß: 36,3 x 52,9 cm";"Papier; Albuminabzug; Tusche (aufgemalter Rauch aus Schornstein)";;Historisches Museum Frankfurt, Frankfurt am Main;Fotografie;;;Die Gutleuthöfe unterhalb Frankfurt;"Der umfangreiche Komplex lag westlich der Stadt unmittelbar am Main und bildete die Kernzelle für die Entwickung dieses Gebiets zum Industriestandort. Er wurde 1873 von der Stiftung ""Allgemeiner Almosenkasten"", die den Hof an Gewerbebetriebe verpachtet hatte, an die Hessische Ludwigs-Eisenbahngesellschaft verkauft.
(Eberhard Mayer-Wegelin, Das alte Frankfurt am Main 1855 - 1890, 2014, S. 238)";"s. Chronik; heute: Werner von Siemens Schule ";50.0959, 8.6456;http://www.fr.de/frankfurt/frankfurt-gutleutviertel-die-seele-entrissen-a-359392;http://www.gutleuthist.de/kleine_chronik_des_gutleuthofes.htm;;;;
Carl Friedrich Mylius;Architektur, Stadttopographie;C03269;ja;;;1861;1870;1866;Frankfurt am Main-Innenstadt, Senckenberg-Institut;Architekturfotografie;"Bildmaß: 23,6 x 16,9 cm; Objektmaß: 53 x 36,4 cm";"Papier; auf Karton aufgezogen; Albuminabzug";;Historisches Museum Frankfurt, Frankfurt am Main;Fotografie;;;Das Senckenberghaus von der Schlimm-Mauer aus gesehen vor dem Abbruch 1866;"Der Blick geht von der Stiftstraße aus zum Eschenheimer Turm, im Vordergrund die sogenannte Schlimme Mauer, die Gartenmauer des Senckenbergischen Geländes. Mylius nahm auch dieses Gebäude kurz vor dem 1866 erfolgten Abriss auf.
(Eberhard Mayer-Wegelin, Das alte Frankfurt am Main 1855 - 1890, 2014, S. 163)";"1866 abgerissen; ehem. Gelände des Senckenbergischen Stiftes; heute: könnte es das Mainova-Service Zentrum sein? ";50.11645,8.68126;;;;;;
Carl Friedrich Mylius;Stadttopographie;C03416;ja;;;1861;1870;1869;Frankfurt am Main-Innenstadt, Roßmarkt, Hauptwache;Fotografie;"Bildmaß: 21,1 x 30,2 cm; Objektmaß: 36,5 x 53 cm Passepartout-Karton";"Passepartout-Karton; Papier; Albuminabzug";"recto, unter Foto: ""C. F. Mylius photogr. [mit Bleistift ergänzt: ""1869""] Eingang des Rossmarkts mit der Hauptwache."" (schwarze Tinte, wahrscheinlich Vermerk des Schenkers, Ferdinand Prestel)";Historisches Museum Frankfurt, Frankfurt am Main;Fotografie;Graphische Sammlung;;Eingang des Roßmarkts mit der Hauptwache;"Vom Roßmarkt sieht man über die Hauptwache, die nach der Einverleibung der Freien Stadt Frankfurt durch Preußen im Jahre 1866 ihre militärische Bedeutung verloren hatte, zu den Häusern am Schillerplatz. Die Straßenbeleuchtung durch Gaslaternen war bereits installiert.
(Eberhard Mayer-Wegelin, Das alte Frankfurt am Main 1855 - 1890, 2014, S. 55, zu dem identischen Motiv in Privatbesitz)";Blick auf Hauptwache von der Straße Roßmarkt;50.1123, 8.67724;https://de.wikipedia.org/wiki/Roßmarkt_(Frankfurt_am_Main);;;;;
Carl Friedrich Mylius;Stadttopographie;C03417;ja;;;1871;1880;1875/1876;Frankfurt am Main-Altstadt, Neue Mainzer Straße 72 (Reichsbank);Fotografie;"Bildmaß: 23,4 x 30,1 cm; Objektmaß: 36,4 x 52,8 cm Passepartout-Karton";"Passepartout-Karton; Papier; Albuminabzug";"recto, unter Foto: ""C. F. Mylius photogr. 1875/76. Die Reichsbank. gebaut von Baurath Lange. Trat in Wirksamkeit 1876. 1 Jan."" (schwarze Tinte, wahrscheinlich Vermerk des Schenkers, Ferdinand Prestel, zum Teil vorher in Bleistift geschrieben und ausradiert)";Historisches Museum Frankfurt, Frankfurt am Main;Fotografie;Graphische Sammlung;;Die Reichsbank in der Neuen Mainzer Straße 72;;"Landesbank Hessen-Thüringen; Ecke Junghofstraße";50.11345,8.67212;;;;;;
Carl Friedrich Mylius;Stadttopographie;C03421;;;;1861;1870;1868;Frankfurt am Main-Nordend, Friedberger Warte;Fotografie;"Bildmaß: 22,9 x 17,2 cm; Objektmaß: 52,8 x 36,5 cm";"Papier; Albuminabzug";"recto, unter Foto: ""C. F. Mylius photog. 1868. Friedberger Warte."" (schwarze Tinte, wahrscheinlich Vermerk des Schenkers, Ferdinand Prestel)";Historisches Museum Frankfurt, Frankfurt am Main;Fotografie;;;Friedberger Warte;"Dieser Turm der Landwehr, der der früheren Stadtbefestigung vorgelagert war, sollte Frankfurt in nordöstlicher Richtung absichern. Er war auf dem höchsten Punkt der Gemarkung des Dorfes Bornheim, das zur Reichsstadt gehörte, angelegt. Wie die anderen Warten blieb der Turm erhalten und war seit 1815 ein Apfelweinlokal.
(Eberhard Mayer-Wegelin, Das alte Frankfurt am Main 1855 - 1890, 2014, S. 243)";Lokal ;50.14048,8.69908;;;;;;
Carl Friedrich Mylius;Stadttopographie;C04357;ja;;;1851;1860;1860;Frankfurt am Main-Altstadt, Wedelgasse, Salzhaus;Fotografie;"Bildmaß: 31 x 24 cm; Objektmaß: 53,2 x 36,5 cm";"Papier; Bleistift (Nachzeichnungen im Bereich der Dächer); Albuminabzug";;Historisches Museum Frankfurt, Frankfurt am Main;Fotografie;Neubau, Ebene 1, Altstadtdrama;;Das Salzhaus mit dem Eingang in die alte Wedelgasse;"Das Haus ganz links hat die Hausnummer ""25""

Das Salzhaus hat die Hausnummer ""27"", dazu die Beschriftung
""H. Schaus""

Das Haus neben dem Salzhaus hat die Geschäftswerbung:
""Zum
Wedel""

""C. WEIMAR. I. EBERBACH. BARUCH ELSAS""

Am Haus ganz rechts ist schwach lesbar:
""G. W. Büstner[?]""";"Römerberg; alte Wedelgasse ist heute die Braubachstraße";50.11074,8.68187;https://de.wikipedia.org/wiki/Salzhaus_(Frankfurt_am_Main)#/media/File:Frankfurt_Altstadt-Position-Salzhaus.jpg;;;evt. könnte man IMG_2701.jpg nehmen;;
Carl Friedrich Mylius;Stadttopographie;C04358;ja;;;1851;1860;1859;Frankfurt am Main-Altstadt, Römerberg, Alter Markt;Fotografie;"Bildmaß: 26,3 x 20,8 cm; Objektmaß: 53 x 36,4 cm";"Papier; auf Karton aufgezogen; Albuminabzug";"verso auf der Fotografie, unten, spiegelverkehrt durchscheinend, runder Stempel mit Stadtadler und Umschrift: ""STADT BIBLIOTHEK FRANKFURT A. M."" (blauer Stempel), vergleiche C04354";Historisches Museum Frankfurt, Frankfurt am Main;Fotografie;Neubau, Ebene 1, Altstadtdrama;;"Römerberg, Eingang zum Alten Markt mit Haus ""Großer Engel""";"mit der Samen-Handlung (Sämereien) von Deumer und Wirth, C. Stumpf Pfefferkorn Nachfolger (lesbar auf kleinem Schild unten links am Haus ""Großer Engel"").";;50.11056,8.68265;https://de.wikipedia.org/wiki/Gro%C3%9Fer_und_Kleiner_Engel;;IMG_2697.jpg;;;
Carl Friedrich Mylius;Stadttopographie;C04363;ja;;;1861;1870;April 1865;Frankfurt am Main-Altstadt, Katharinenpforte;Fotografie;"Bildmaß: 23,3 x 17,7 cm; Objektmaß: 52,7 x 36,3 cm";"Papier; auf Karton aufgezogen; Albuminabzug";"verso auf der Fotografie, unten, spiegelverkehrt durchscheinend, schwach erkennbar, runder Stempel mit Stadtadler und Umschrift: ""STADT BIBLIOTHEK FRANKFURT A. M."" (blauer Stempel), vergleiche C04354";Historisches Museum Frankfurt, Frankfurt am Main;Fotografie;;;Blick auf die Katharinenpforte;"Die Katharinenpforte verband die Altstadt mit der im Hintergrund sichtbaren Hauptwache. Der Name leitet sich von der Katharinenkirche ab, die sich am nordöstlichen Ende befindet. Bis zur Stadterweiterung im 14. Jahrhundert befand sich hier in der ursprünglichen staufischen Stadtmauer einer der Zugänge zur Stadt.
(Eberhard Mayer-Wegelin, Das alte Frankfurt am Main 1855 - 1890, 2014, S. 143)


linker Bildrand: Hinweis auf
""MAISON
DE
CONFECTI[ON]
Katharinen[...]
N. 1""

rechts das Geschäft von
""F. Fischer.""";;50.11285,8.67921;;;;;;
Carl Friedrich Mylius;Stadttopographie;C04365;;;;1851;1861;vor 1861;Frankfurt am Main-Altstadt, Neue Kräme;Fotografie;"Bildmaß: 22,9 x 16,9 cm; Objektmaß: 52,9 x 36,2 cm";"Papier; auf Karton aufgezogen; Albuminabzug";"verso auf der Fotografie, unten, spiegelverkehrt durchscheinend, schwach erkennbar, runder Stempel mit Stadtadler und Umschrift: ""STADT BIBLIOTHEK FRANKFURT A. M."" (blauer Stempel), vergleiche C04354";Historisches Museum Frankfurt, Frankfurt am Main;Fotografie;;;Neue Kräme, Geschäftshaus der Firma Heinrich Wilhelm Schmidt mit dem Eckhaus, abgerissen 1861 und durch einen Neubau ersetzt;"Das Eckhaus des Tee-Händlers Heinrich Wilhelm Schmidt wurde 1862 abgerissen, das Nachbargebäude rechts ist bereits niedergelegt. An dieser Stelle trafen zwei der wichtigsten Verkehrswege der Altstadt aufeinander.
(Eberhard Mayer-Wegelin, Das alte Frankfurt am Main 1855 - 1890, 2014, S. 142)

Die Geschäfte:
Tuchlager von C. Heinemann und
Waaren(sic) Lager von Heinrich Wilhelm Schmidt";;;https://de.wikipedia.org/wiki/Neue_Kräme;;;;;
Carl Friedrich Mylius;Stadttopographie;C04366;ja;;;1851;1860;1860;Frankfurt am Main-Innenstadt, Schillerplatz;Fotografie;"Bildmaß: 21,9 x 18,4 cm; Objektmaß: 53 x 36,4 cm";"auf Karton aufgezogen; Papier; Albuminabzug";"verso, spiegelverkehrt durchscheinend, oben mitte: eine Zahl (20?), darunter eine Beschriftung (""Mylius ...""?) (blauer Stift)";Historisches Museum Frankfurt, Frankfurt am Main;Fotografie;;;Die Schmiede an der Nordseite des Schillerplatzes;;"heute Alemanniahaus; Nordseite des Schillerplatzes";50.11419, 8.67887;;;;;;
Carl Friedrich Mylius;Historie, profan, Stadttopographie;C04368;;;;1861;1870;Mai 1861;Frankfurt am Main-Westend, Kettenhofweg;Fotografie;"Bildmaß: 20,9 x 16,8 cm; Blattmaß: 24,7 x 19,1 cm; Objektmaß: 53 x 36,4 cm zusammen mit C30077 auf einem Karton";"Papier; auf Karton aufgezogen; Albuminabzug";"recto, unter Fotografie: ""Gartenhaus am Kettenhofwege. Niedergelegt 1861 In diesem Hause schrieb Knigge sein Buch: 'Umgang mit Menschen' "" (schwarzer Faserschreiber)";Historisches Museum Frankfurt, Frankfurt am Main;Fotografie;;;"Gartenhaus am Kettenhofweg, abgebrochen 1861. In diesem Hause schrieb Knigge sein Buch ""Umgang mit Menschen""";"Der Kettenhofweg zweigt von der Bockenheimer Landstraße ab und war zur Zeit der Aufnahme erst teilweise erschlossen. In Erwartung der Bebauung wurden Gartenhäuser, die ursprünglich der Sommerfrische dienten, niedergelegt.
(Eberhard Mayer-Wegelin, Das alte Frankfurt am Main 1855 - 1890, 2014, S. 217)";;50.11538, 8.66896;;;;;;
Carl Friedrich Mylius;Architektur, Stadttopographie;C04792d;ja;;;1855;1875;um 1865;Frankfurt am Main-Altstadt, Römerberg (Justitiabrunnen);Fotografie;"Bildmaß: 29 x 21,8 cm; Blattmaß: 31,5 x 24,4 cm; Objektmaß: 53 x 36,5 cm";"Papier; auf Karton aufgezogen; Albuminabzug";;Historisches Museum Frankfurt, Frankfurt am Main;Fotografie;;;Der Justitiabrunnen auf dem Römerberg von Norden;"Die Reliefs zeigen antike und christliche Tugenden, dem Betrachter halb zugewandt ist die Justitia. Im Hintergrund die Nikolaikirche.
(Eberhard Mayer-Wegelin, Das alte Frankfurt am Main 1855 - 1890, 2014, S. 203)";;50.11040,8.68214;https://de.wikipedia.org/wiki/Gerechtigkeitsbrunnen_(Frankfurt_am_Main;;;;;
Carl Friedrich Mylius;Architektur, Stadttopographie;C05494;;;;1851;1860;1860;Frankfurt am Main-Innenstadt, Eschersheimer Landstraße (Haus Trier);Fotografie;"Bildmaß: 21,2 x 25,4 cm; Objektmaß: 36,5 x 53,1 cm";"Papier; auf Karton aufgezogen; Albuminabzug";;Historisches Museum Frankfurt, Frankfurt am Main;Fotografie;;;Haus Trier in der Eschersheimer Landstraße am Eschenheimer Tor, niedergelegt 1872 (jetzt an dieser Stelle: Konservatorium);"An dieser Stelle wurde zehn Jahre später das Gebäude des Dr. Hochschen Conservatoriums errichtet.
(Eberhard Mayer-Wegelin, Das alte Frankfurt am Main 1855 - 1890, 2014, S. 180)

Die Straße, die im Bild nach hinten führt, ist die Eschersheimer Landstraße; die Straße im Vordergrund die Eschenheimer Anlage (so auf den Schildern im Bild unten rechts zu lesen)";"1872 niedergelegt; jetzt Konservatorium??? nichts gefunden";50.12027, 8.67624;;;;;;
Carl Friedrich Mylius;Stadttopographie;C06854;ja;;;1851;1860;1860;Frankfurt am Main-Altstadt, Alter Markt (Steinernes Haus);Fotografie;"Bildmaß: 24,2 x 17,3 cm; Blattmaß: 25,2 x 18 cm; Objektmaß: 52,9 x 36,6 cm";"Papier; auf Karton aufgezogen; Albuminabzug";;Historisches Museum Frankfurt, Frankfurt am Main;Fotografie;;;Madonna am Eck des Steinernen Haus auf dem alten Markt, 1464;"Die spätgotische Skulptur befand sich an der westlichen Ecke der Vorderfront zum Römerberg. Der Baldachin wurde 1872 entfernt, weil sich Teile lösten und Marktfrauen sich gefährdet sahen, später aber wieder angebracht. Seit dem Wiederaufbau des Steinernen Hauses im Jahre 1962 ist dort eine Kopie zu sehen.
(Eberhard Mayer-Wegelin, Das alte Frankfurt am Main 1855 - 1890, 2014, S. 145)";;50.11071,8.68278;https://de.wikipedia.org/wiki/Steinernes_Haus_(Frankfurt_am_Main)#/media/File:Frankfurt_Altstadt-Position-Steinernes_Haus-Ravenstein1861.jpg;https://de.wikipedia.org/wiki/Steinernes_Haus_(Frankfurt_am_Main);;;;
"Carl Friedrich Mylius; Kein Eintrag, alte Zuschreibung; J. M. Pohl";Dokumentarfotografie, Historie, profan, Stadttopographie;C07406;;;;1871;1880;15.03.1871;Frankfurt am Main-Innenstadt, Rossmarkt;Dokumentarfotografie;"Bildmaß: 21,8 x 30 cm; Objektmaß: 36,2 x 47,2 cm";"Papier; Albuminabzug";"auf Tafel an der Dekoration: ""Paris 1814. 1815. 1871.""";Historisches Museum Frankfurt, Frankfurt am Main;Fotografie;;;Dekoration des Roßmarktes beim Einzug des Kaisers Wilhelm und der vom Kriege heimfahrenden Truppen;"Wilhelm I. kam nach Abschluss des Vorfriedens von Versailles am 15. März 1871 nach Frankfurt, wo dann im Mai die Friedensverhandlungen im Hotel zum Schwan stattfanden.
(Eberhard Mayer-Wegelin, Das alte Frankfurt am Main 1855 - 1890, 2014, S. 269)";s. Roßmarkt;;;;;;;
Carl Friedrich Mylius;Stadttopographie;C07844;;;;1870;1890;um 1880;Frankfurt am Main-Innenstadt, Stelzengasse, Porzellanhof;Fotografie;"Bildmaß: 13,3 x 9,7 cm; Objektmaß: 53 x 36,5 cm zusammen mit C20516 auf einem Karton";"Papier; auf Karton aufgezogen; Albuminabzug";;Historisches Museum Frankfurt, Frankfurt am Main;Fotografie;;;Porzellanhof, Stelzengasse, Hofansicht;"Zu dem Hof östlich der Konstablerwache gehörte ein großer Gebäudekomplex, der 1879 der Verlängerung der Zeil weichen mußte. Der Name geht auf eine Porzellanmanufaktur zurück, die im 18. Jahrhundert dort betrieben wurde.
(Eberhard Mayer-Wegelin, Das alte Frankfurt am Main 1855 - 1890, 2014, S. 176)";Stelzengasse, gibt es die noch?  Ist aber nicht die Porzellanmanufraktur in Höchst?;;;;;;;
Carl Friedrich Mylius;Stadttopographie;C07960;ja;;;1861;1870;1867;Frankfurt am Main-Altstadt, Römerberg;Fotografie;"Bildmaß: 24 x 29,4 cm; Objektmaß: 36,5 x 53 cm";"Papier; auf Karton aufgezogen; Albuminabzug";;Historisches Museum Frankfurt, Frankfurt am Main;Fotografie;Neubau, Ebene 1, Altstadtdrama;;Westseite des Römerbergs;"Die Geschäfte von links nach rechts (vergleiche auch C07961):

Theater & Markengarderobe
[Inhabername nicht lesbar]
Restauration
[nicht lesbar] Eisenberg

ZUM ALTEN STRAHLENBERG
Färb-Drucke & Fein Wascherei [sic]
GEORG KLEIN

Möbel-Lager von F. Lauenstein

Buchdruckerei

F. Lauenstein

[nicht lesbar]sken Garderobe
Friedr. Löw 1. Stock
Trinkstube zum alten Limpurg";;50.11049,8.68172;https://de.wikipedia.org/wiki/Römerberg_(Frankfurt_am_Main);;IMG_2698;;;
